{
  "schema": "mindforge.content_asset_recipe.v1",
  "asset_id": "mf_cathedral_arch_v10",
  "semantic_role": "arch",
  "districts": ["sanctum", "promenade", "cathedral"],
  "source": {
    "kind": "generated_fallback",
    "tool": "mindforge_production_mesh_library",
    "tool_version": "v0.9",
    "prompt_hash": null,
    "reference_hashes": [],
    "license": "project_authored",
    "redistribution_policy": "repository_safe"
  },
  "geometry": {
    "target_size_m": [4.2, 6.6, 0.85],
    "forward_axis": "+z",
    "up_axis": "+y",
    "pivot_policy": "bottom_center",
    "max_triangles": 24000,
    "max_submeshes": 4
  },
  "render": {
    "material_family": "sanctum_pearl_stone",
    "max_materials": 3,
    "texture_max_px": 2048,
    "lod_ratios": [1.0, 0.55, 0.22],
    "cast_shadows": true,
    "receive_shadows": true
  },
  "unity": {
    "target_tokens": ["Arch", "Arcade", "Threshold"],
    "fallback_symbol": "ProductionMeshLibraryV09.PointedArch"
  },
  "authority": {
    "gameplay": false,
    "collision": false,
    "bci": false
  },
  "quality": {
    "minimum_score": 0.72,
    "require_finite_normals": true,
    "require_nonzero_bounds": true,
    "reject_magenta_material": true
  }
}
